{
  "$schema": "https://json-schema.org/draft/2020-12/schema",
  "$id": "https://github.com/freemansoft/entitopia/schema/configuration.schema.json",
  "title": "entitopia project configuration",
  "description": "The project file execute_project.py loads: which steps exist, and which phases each runs.",
  "type": "object",
  "additionalProperties": false,
  "required": ["steps", "configurationDir", "dataDir"],
  "properties": {
    "steps": {
      "type": "array",
      "description": "Run in declared order. A step's name is also its configuration subdirectory.",
      "items": {
        "type": "object",
        "additionalProperties": false,
        "required": ["name", "phases"],
        "properties": {
          "name": { "type": "string" },
          "phases": {
            "type": "array",
            "minItems": 1,
            "description": "Closed on purpose. An unrecognized phase name reaches the dispatcher's else branch, logs an error, and lets the run continue having silently skipped that work — so a typo here costs a whole phase with a green-looking run.",
            "items": {
              "enum": [
                "index-create",
                "index-map",
                "enrichment-policies",
                "pipelines",
                "index-populate",
                "entity-match",
                "validate"
              ]
            }
          }
        }
      }
    },
    "all_phases": {
      "type": "array",
      "items": { "type": "string" },
      "description": "Documentation of the phases this project may use. Not enforced against steps: it records intent, and a step naming a phase absent from here is legal."
    },
    "configurationDir": { "type": "string" },
    "dataDir": { "type": "string" },
    "logLevel": {
      "enum": ["DEBUG", "INFO", "WARNING", "ERROR", "CRITICAL"],
      "description": "Passed to logger.setLevel. An unrecognized value is caught by AttributeError at startup and warned about, leaving the default level in place."
    }
  }
}
