{
  "steps": [
    {
      "name": "doctors-clinicians",
      "phases": ["validate", "index-create", "index-map", "index-populate"]
    },
    {
      "name": "facillity-affiliations",
      "phases": ["validate", "index-create", "index-map", "index-populate"]
    },
    {
      "name": "hospitals",
      "phases": ["validate", "index-create", "index-map", "index-populate"]
    }
  ],
  "all_phases": [
    "index-create",
    "index-map",
    "enrichment-policies",
    "pipelines",
    "index-populate",
    "validate"
  ],
  "configurationDir": "configuration",
  "dataDir": "data",
  "logLevel": "INFO"
}
